Key,Page,Section,English,Thai,Notes
pricing.calc_heading,pricing,CALCULATOR,Calculate Your Price,คำนวณราคาของคุณ,
pricing.calc_intro,pricing,CALCULATOR,Simple. More volume, lower rate.,ง่ายๆ ปริมาณมาก ราคาต่อหน่วยยิ่งถูกลง,
pricing.calc_subtitle,pricing,CALCULATOR,Pay only for what you need. Credits never expire.,จ่ายเฉพาะสิ่งที่คุณต้องการ เครดิตไม่มีวันหมดอายุ,
pricing.calc_title,pricing,CALCULATOR,Pricing Calculator,เครื่องคำนวณราคา,
pricing.need_more,pricing,CALCULATOR,Need more than 1 million?,ต้องการมากกว่า 1 ล้าน?,
pricing.custom_pricing,pricing,CALCULATOR,for custom pricing.,เพื่อขอราคาพิเศษ,
pricing.contact_us,pricing,CALCULATOR,Contact us,ติดต่อเรา,
pricing.cta_clean_title,pricing,CTA,Get My List Cleaned,ล้างรายชื่อของฉัน,
pricing.cta_clean_desc,pricing,CTA,Done-for-you service. Send your list, get results.,บริการแบบครบวงจร ส่งรายชื่อมา รับผลลัพธ์กลับไป,
pricing.cta_waitlist_title,pricing,CTA,Join the Waitlist,เข้าร่วมรายชื่อรอ,
pricing.cta_waitlist_desc,pricing,CTA,Be first to access self-serve when it launches.,เป็นคนแรกที่ได้ใช้บริการแบบ Self-serve เมื่อเปิดตัว,
pricing.cta_help_title,pricing,CTA,Get Free Help,รับความช่วยเหลือฟรี,
pricing.cta_help_desc,pricing,CTA,Email our SOS hotline with your questions.,ส่งคำถามของคุณมาที่สายด่วน SOS ของเรา,DNT SOS Hotline
pricing.learn_more_btn,pricing,CTA,Learn More,เรียนรู้เพิ่มเติม,
pricing.option_guidance,pricing,OPTIONS,Guidance,คำแนะนำ,
pricing.option_execution,pricing,OPTIONS,Execution,การดำเนินการ,
pricing.option_automation,pricing,OPTIONS,Automation,ระบบอัตโนมัติ,
pricing.join,pricing,CONTENT,Join,เข้าร่วม,
pricing.get_started_btn,pricing,CONTENT,Get Started,เริ่มต้นใช้งาน,
pricing.questions_title,pricing,CONTENT,Questions?,มีคำถาม?,
pricing.waitlist_success_short,pricing,CONTENT,You're on the list!,คุณอยู่ในรายชื่อแล้ว!,
pricing.newsletter_opt,pricing,CONTENT,"Monthly deliverability insights (no spam, just signal)","ข้อมูลเชิงลึก Deliverability รายเดือน (ไม่มีสแปม มีแต่สาระ)",
pricing.for_custom,pricing,CONTENT,for custom pricing.,เพื่อขอราคาพิเศษ,
pricing.learn_more_sos,pricing,CONTENT,Learn More About SOS Hotline,เรียนรู้เพิ่มเติมเกี่ยวกับสายด่วน SOS,DNT SOS Hotline
pricing.free_help_title,pricing,FREE HELP,Free Email Help,ความช่วยเหลือเรื่องอีเมลฟรี,
pricing.free_help_desc,pricing,FREE HELP,"Ask any email question. Get a real answer from a real expert. No sales pitch, no strings attached.","ถามคำถามเรื่องอีเมลได้ทุกเรื่อง รับคำตอบจริงจากผู้เชี่ยวชาญตัวจริง ไม่มีการขาย ไม่มีข้อผูกมัด",
pricing.hero_headline1,pricing,HERO,Beyond Validation.,เหนือกว่าการตรวจสอบ (Validation),
pricing.hero_headline2,pricing,HERO,We Tell You What Your List Means.,เราบอกคุณว่ารายชื่อของคุณหมายความว่าอย่างไร,
pricing.hero_subhead,pricing,HERO,"Not just pass/fail. Every address comes with reasoning so you know what to keep, what to monitor, and what to suppress.","ไม่ใช่แค่ผ่าน/ไม่ผ่าน ทุกที่อยู่มีเหตุผลประกอบ เพื่อให้คุณรู้ว่าควรเก็บอะไร ควรเฝ้าระวังอะไร และควรระงับ (Suppress) อะไร",DNT Keep/Monitor/Suppress
pricing.what_you_get_title,pricing,OUTPUT,What You Get,สิ่งที่คุณจะได้รับ,
pricing.what_you_get_subtitle,pricing,OUTPUT,A cleaned list with clear recommendations.,รายชื่อที่ล้างแล้วพร้อมคำแนะนำที่ชัดเจน,
pricing.keep_title,pricing,OUTPUT,Cleared After Full Review,ผ่านการตรวจสอบอย่างละเอียดแล้ว,
pricing.keep_desc,pricing,OUTPUT,No risk patterns surfaced during review. Domain behavior and historical signals support continued sending.,ไม่พบรูปแบบความเสี่ยงระหว่างการตรวจสอบ พฤติกรรมโดเมนและสัญญาณในอดีตสนับสนุนให้ส่งต่อได้,
pricing.monitor_title,pricing,OUTPUT,Patterns Worth Watching,รูปแบบที่น่าจับตามอง,
pricing.monitor_desc,pricing,OUTPUT,"These require judgment. We surface historical patterns and relationship context.",สิ่งเหล่านี้ต้องใช้วิจารณญาณ เราเปิดเผยรูปแบบในอดีตและบริบทความสัมพันธ์,
pricing.suppress_title,pricing,OUTPUT,"Clear Risk, Clear Reasoning",ความเสี่ยงชัดเจน เหตุผลชัดเจน,
pricing.suppress_desc,pricing,OUTPUT,"Clear risk signals: known problem domains, disposable patterns, historical trap indicators.",สัญญาณความเสี่ยงชัดเจน: โดเมนที่มีปัญหา, รูปแบบอีเมลใช้แล้วทิ้ง, ตัวบ่งชี้กับดักในอดีต,
pricing.who_title,pricing,WHO FOR,Who This Is For,บริการนี้เหมาะกับใคร,
pricing.who_subtitle,pricing,WHO FOR,Marketers who already send email and want to protect their sender reputation.,นักการตลาดที่ส่งอีเมลอยู่แล้วและต้องการปกป้องชื่อเสียงผู้ส่ง (Sender Reputation),
pricing.who_note,pricing,WHO FOR,"If you care about long-term reputation, not just short-term volume, this is for you.","ถ้าคุณแคร์ชื่อเสียงระยะยาว ไม่ใช่แค่ปริมาณระยะสั้น นี่คือสิ่งที่คุณต้องการ",
pricing.who_item1,pricing,WHO FOR,Running campaigns but seeing declining engagement,กำลังรันแคมเปญแต่เห็นยอดการมีส่วนร่วมลดลง,
pricing.who_item2,pricing,WHO FOR,"Worried about bounces, complaints, or blocklists",กังวลเรื่องการตีกลับ (Bounces), การร้องเรียน, หรือการติด Blacklist,
pricing.who_item3,pricing,WHO FOR,Inheriting a list you did not build,รับช่วงต่อรายชื่อที่คุณไม่ได้สร้างเอง,
pricing.who_item4,pricing,WHO FOR,"Under pressure to ""just send"" but sensing risk","ถูกกดดันให้ ""ส่งๆ ไปเถอะ"" แต่รู้สึกถึงความเสี่ยง",
pricing.who_item5,pricing,WHO FOR,Trying to explain deliverability to a boss who does not get it,พยายามอธิบายเรื่อง Deliverability ให้หัวหน้าคนที่ไม่เข้าใจฟัง,
quiz.loading_analyzing,quiz,LOADING,Analyzing your responses...,กำลังวิเคราะห์คำตอบของคุณ...,
quiz.loading_comparing,quiz,LOADING,Comparing against common patterns,กำลังเปรียบเทียบกับรูปแบบทั่วไป,
quiz.loading_checking,quiz,LOADING,Checking risk indicators...,กำลังตรวจสอบตัวบ่งชี้ความเสี่ยง...,
quiz.loading_matching,quiz,LOADING,Matching against known patterns,กำลังจับคู่กับรูปแบบที่รู้จัก,
quiz.loading_preparing,quiz,LOADING,Preparing your diagnosis...,กำลังเตรียมผลวินิจฉัยของคุณ...,
quiz.step_indicator,quiz,INTRO,Question {n} of {total},คำถามที่ {n} จาก {total},Use {n} and {total} as placeholders
quiz.step_1_of_4,quiz,QUESTIONS,Question 1 of 4,คำถามที่ 1 จาก 4,
quiz.q1_text,quiz,QUESTIONS,How did the majority of these emails get on your list?,อีเมลส่วนใหญ่ในรายชื่อนี้มาได้อย่างไร?,
quiz.q2_text,quiz,QUESTIONS,Is your sending domain authenticated with DMARC?,โดเมนส่งอีเมลของคุณมีการยืนยันตัวตนด้วย DMARC หรือไม่?,DNT DMARC
quiz.q3_text,quiz,QUESTIONS,Have you run this list through a validation tool?,คุณเคยนำรายชื่อนี้ไปผ่านเครื่องมือตรวจสอบ (Validation) หรือไม่?,
quiz.q4_text,quiz,QUESTIONS,What brought you here today?,อะไรพาคุณมาที่นี่วันนี้?,
quiz.pattern_line,quiz,RESULTS,This is one of the most common patterns I see.,นี่เป็นหนึ่งในรูปแบบที่พบบ่อยที่สุดที่ฉันเจอ,
quiz.badge_higher_risk,quiz,RESULTS,Higher Risk,ความเสี่ยงสูงกว่า,
quiz.badge_critical,quiz,RESULTS,Critical,วิกฤต,
quiz.badge_high_risk,quiz,RESULTS,High Risk,ความเสี่ยงสูง,
quiz.badge_medium_risk,quiz,RESULTS,Medium Risk,ความเสี่ยงปานกลาง,
quiz.badge_low_risk,quiz,RESULTS,Low Risk,ความเสี่ยงต่ำ,
quiz.what_well_do,quiz,RESULTS,What we'll do,สิ่งที่เราจะทำ,
quiz.what_this_means,quiz,RESULTS,What this means,สิ่งนี้หมายความว่าอย่างไร,
quiz.reality_check_title,quiz,RESULTS,What we'll do,สิ่งที่เราจะทำ,
quiz.reality_check_title_alt,quiz,RESULTS,What this means,สิ่งนี้หมายความว่าอย่างไร,
quiz.cta_talk_specialist,quiz,RESULTS,Talk to a Specialist,คุยกับผู้เชี่ยวชาญ,
quiz.cta_full_review,quiz,RESULTS,Get a full review,รับการตรวจสอบฉบับเต็ม,
quiz.cta_diagnose,quiz,RESULTS,Let's diagnose this,มาวินิจฉัยเรื่องนี้กัน,
quiz.cta_clarity,quiz,RESULTS,Get clarity on your list,สร้างความชัดเจนให้รายชื่อของคุณ,
quiz.cta_get_diagnosis,quiz,CTA,Get the diagnosis,รับผลวินิจฉัย,
quiz.cta_safety_check,quiz,CTA,Get a safety check,รับการตรวจสอบความปลอดภัย,
quiz.res_infra_headline,quiz,RESULTS,Your infrastructure may be the problem.,โครงสร้างพื้นฐานของคุณอาจเป็นปัญหา,
quiz.res_catchall_headline,quiz,RESULTS,Those ""Unknown"" addresses are not unknown to me.,ที่อยู่ ""Unknown"" เหล่านั้น ไม่ใช่สิ่งลึกลับสำหรับฉัน,
quiz.res_decay_headline,quiz,RESULTS,Your list is slowly suffocating your delivery.,รายชื่อของคุณกำลังค่อยๆ บั่นทอนการส่งอีเมลของคุณ,
quiz.res_preventive_headline,quiz,RESULTS,You are in a good spot. Let's keep it that way.,คุณอยู่ในจุดที่ดีแล้ว มาช่วยกันรักษาไว้เถอะ,
quiz.res_noconsent_headline,quiz,RESULTS,We can absolutely help clean your list.,เราช่วยล้างรายชื่อของคุณได้แน่นอน,
quiz.res_crisis_headline,quiz,RESULTS,You need triage, not just cleaning.,คุณต้องการการคัดแยกผู้ป่วย (Triage) ไม่ใช่แค่การล้าง,
quiz.res_toolfail_headline,quiz,RESULTS,Your validation tool missed something.,เครื่องมือตรวจสอบของคุณพลาดอะไรบางอย่างไป,
quiz.res_noconsent_subhead,quiz,RESULTS,Lists without explicit consent carry more risk—but that doesn't mean you can't send safely. We'll remove the addresses most likely to hurt you.,รายชื่อที่ไม่มีการยินยอมชัดเจนมีความเสี่ยงสูงกว่า แต่ไม่ได้หมายความว่าคุณส่งอย่างปลอดภัยไม่ได้ เราจะลบที่อยู่ที่มีแนวโน้มจะทำร้ายคุณมากที่สุดออก,
quiz.res_crisis_subhead,quiz,RESULTS,An ESP warning is the final straw. Your reputation is already damaged. Automated cleaning alone will not get you reinstated.,คำเตือนจาก ESP คือฟางเส้นสุดท้าย ชื่อเสียงของคุณเสียหายไปแล้ว การล้างอัตโนมัติเพียงอย่างเดียวจะไม่ช่วยให้คุณกลับมาได้,DNT ESP
quiz.res_toolfail_subhead,quiz,RESULTS,You paid for syntax checking. You were punished for reputation. A 'Valid' email can still be a spam trap or chronic complainer.,คุณจ่ายเงินค่าเช็คไวยากรณ์ แต่ถูกลงโทษเรื่องชื่อเสียง อีเมลที่ 'Valid' ยังคงเป็น Spam Trap หรือคนที่ชอบร้องเรียนได้,
quiz.res_infra_subhead,quiz,RESULTS,Without proper DMARC authentication, even a clean list can land in spam. This is a fixable issue, but it needs attention before list cleaning matters.,หากไม่มีการยืนยันตัวตน DMARC ที่ถูกต้อง แม้แต่รายชื่อที่สะอาดก็อาจลง Spam ได้ ปัญหานี้แก้ได้ แต่ต้องใส่ใจก่อนที่จะไปกังวลเรื่องการล้างรายชื่อ,DNT DMARC
quiz.res_catchall_subhead,quiz,RESULTS,Catch-all domains accept everything. Validation tools cannot tell you which addresses are real. I can.,โดเมน Catch-all รับทุกอย่าง เครื่องมือตรวจสอบบอกไม่ได้ว่าที่อยู่ไหนมีจริง แต่ฉันบอกได้,
quiz.res_decay_subhead,quiz,RESULTS,No bounce spike. No warning. Just a quiet decline as dead weight accumulates and inbox providers filter you to spam.,ไม่มี Bounce พุ่งสูง ไม่มีคำเตือน มีแต่การลดลงอย่างเงียบๆ เมื่อน้ำหนักส่วนเกินสะสม และผู้ให้บริการ Inbox กรองคุณลง Spam,
quiz.res_preventive_subhead,quiz,RESULTS,Healthy lists still decay by about 22% every year. A preventative review before a big send catches recycled traps that formed since your last campaign.,รายชื่อที่มีคุณภาพยังเสื่อมลงประมาณ 22% ทุกปี การตรวจสอบป้องกันก่อนส่งล็อตใหญ่จะช่วยจับกับดัก (Traps) ที่เพิ่งเกิดขึ้นตั้งแต่แคมเปญล่าสุดของคุณ,
quiz.res_noconsent_reality,quiz,RESULTS,"We catch invalid addresses, spam traps, role accounts, and high-risk patterns that other validators miss. We're thorough. But we're also honest: no tool can catch every trap on a non-consent list because some are designed to be undetectable. That's true for every validator—we're just the ones who tell you.","เราจับที่อยู่ไม่ถูกต้อง, Spam Traps, บัญชี Role, และรูปแบบความเสี่ยงสูงที่เครื่องมืออื่นพลาด เราละเอียดรอบคอบ แต่เราก็จริงใจ: ไม่มีเครื่องมือไหนจับกับดักได้ทุกตัวในรายชื่อที่ไม่มีการยินยอม เพราะบางตัวถูกออกแบบมาให้ตรวจจับไม่ได้ นั่นเป็นความจริงสำหรับทุกเครื่องมือ—เราแค่เป็นคนที่บอกความจริงกับคุณ",
quiz.res_crisis_reality,quiz,RESULTS,You need a remediation strategy, not just a clean list. I help identify the root cause and build a path back to good standing with your ESP.,คุณต้องการกลยุทธ์การเยียวยา ไม่ใช่แค่รายชื่อสะอาด ฉันช่วยระบุสาเหตุต้นตอและสร้างเส้นทางกลับสู่สถานะที่ดีกับ ESP ของคุณ,DNT ESP
quiz.res_toolfail_reality,quiz,RESULTS,Automated tools cannot see behavioral history. They check code, not context. I find the 'Valid but Dangerous' addresses they miss.,เครื่องมืออัตโนมัติมองไม่เห็นประวัติพฤติกรรม มันเช็คโค้ด ไม่ใช่บริบท ฉันหาที่อยู่ 'Valid แต่อันตราย' ที่พวกมันพลาด,
quiz.res_infra_reality,quiz,RESULTS,Domain authentication tells inbox providers you are who you say you are. Without it, your emails look suspicious regardless of list quality.,การยืนยันตัวตนโดเมนบอกผู้ให้บริการ Inbox ว่าคุณคือคนที่คุณอ้างว่าเป็น หากไม่มีมัน อีเมลของคุณจะดูน่าสงสัยไม่ว่ารายชื่อจะดีแค่ไหน,
quiz.res_catchall_reality,quiz,RESULTS,A large percentage of business domains are catch-all. Validation marks them 'Unknown' because it cannot verify. Pattern recognition and engagement history tell a different story.,เปอร์เซ็นต์ใหญ่ของโดเมนธุรกิจคือ Catch-all เครื่องมือตรวจสอบระบุว่าเป็น 'Unknown' เพราะเช็คไม่ได้ แต่การจดจำรูปแบบและประวัติการมีส่วนร่วมบอกเล่าเรื่องราวที่ต่างออกไป,
quiz.res_decay_reality,quiz,RESULTS,This is the hardest problem to diagnose because there is no event. Your list has accumulated decay, and it is dragging down your engaged subscribers.,นี่เป็นปัญหาที่วินิจฉัยยากที่สุดเพราะไม่มีเหตุการณ์แจ้งเตือน รายชื่อของคุณสะสมความเสื่อมโทรม และมันกำลังฉุดรั้งผู้ติดตามที่มีส่วนร่วมของคุณลงมา,
quiz.res_preventive_reality,quiz,RESULTS,You are doing the right things. A safety check ensures you do not accidentally hit a trap that did not exist last time you sent.,คุณกำลังทำสิ่งที่ถูกต้อง การตรวจสอบความปลอดภัยช่วยให้มั่นใจว่าคุณจะไม่เผลอไปโดนกับดักที่ยังไม่มีในครั้งล่าสุดที่คุณส่ง,
quiz.additional_issues_title,quiz,RESULTS,Other things we noticed,สิ่งอื่นๆ ที่เราสังเกตเห็น,
quiz.result_directlink,quiz,RESULTS,Ready to go?,พร้อมหรือยัง?,
quiz.get_list_cleaned,quiz,RESULTS,Get My List Cleaned →,ล้างรายชื่อของฉัน →,
quiz.save_diagnosis,quiz,CAPTURE,Save your diagnosis,บันทึกผลวินิจฉัยของคุณ,
quiz.save_subtitle,quiz,CAPTURE,Get your results emailed and optionally join our waitlist for self-serve tools.,รับผลลัพธ์ทางอีเมลและเลือกเข้าร่วมรายชื่อรอสำหรับเครื่องมือ Self-serve,
quiz.newsletter_opt,quiz,CAPTURE,"Monthly deliverability insights (no spam, just signal)","ข้อมูลเชิงลึก Deliverability รายเดือน (ไม่มีสแปม มีแต่สาระ)",
quiz.bonus_credits,quiz,CAPTURE,1,500 credits when we launch,1,500 เครดิตเมื่อเราเปิดตัว,
quiz.send_results,quiz,CAPTURE,Send My Results,ส่งผลลัพธ์ให้ฉัน,
quiz.skip,quiz,CAPTURE,Skip,ข้าม,
quiz.notify_launch,quiz,CAPTURE,Notify me when self-serve launches,แจ้งเตือนฉันเมื่อเปิดตัว Self-serve,
quiz.request_contact,quiz,CAPTURE,Have someone reach out to discuss my situation (no sales pitch),ให้เจ้าหน้าที่ติดต่อกลับเพื่อหารือเกี่ยวกับสถานการณ์ของฉัน (ไม่มีการขาย),
quiz.capture_success,quiz,CAPTURE,Your results have been sent!,ส่งผลลัพธ์ของคุณเรียบร้อยแล้ว!,
quiz.capture_credits_bonus,quiz,CAPTURE,You've also earned 1,500 free credits.,คุณยังได้รับ 1,500 เครดิตฟรีอีกด้วย,
quiz.capture_reach_out,quiz,CAPTURE,We'll reach out soon.,เราจะติดต่อกลับเร็วๆ นี้,
quiz.ready_to_go,quiz,CAPTURE,Ready to go?,พร้อมหรือยัง?,
sos.bridge_dfy_cta,sos-hotline,BRIDGE,See What You Get,ดูสิ่งที่คุณจะได้รับ,
sos.bridge_dfy_desc,sos-hotline,BRIDGE,"Send us your list. We review every address and return it labeled: Keep, Monitor, or Suppress.","ส่งรายชื่อมาให้เรา เราตรวจสอบทุกที่อยู่และส่งคืนพร้อมป้ายกำกับ: เก็บ, เฝ้าระวัง, หรือ ระงับ",DNT Keep/Monitor/Suppress
sos.bridge_dfy_title,sos-hotline,BRIDGE,Done-For-You Review,การตรวจสอบแบบครบวงจร (Done-For-You),
sos.bridge_expert_cta,sos-hotline,BRIDGE,See the Process,ดูกระบวนการ,
sos.bridge_expert_desc,sos-hotline,BRIDGE,Every list review includes a walkthrough of your results. We explain what we found.,ทุกการตรวจสอบรายชื่อรวมถึงการอธิบายผลลัพธ์ เราอธิบายสิ่งที่เราพบ,
sos.bridge_expert_title,sos-hotline,BRIDGE,Expert Interpretation,การตีความโดยผู้เชี่ยวชาญ,
sos.bridge_intro,sos-hotline,BRIDGE,"SOS gives you guidance. If you need someone to actually touch your data, we offer:",SOS ให้คำแนะนำ ถ้าคุณต้องการใครสักคนที่มาจัดการข้อมูลของคุณจริงๆ เราเสนอ:,DNT SOS
sos.bridge_title,sos-hotline,BRIDGE,Need More Than Advice?,ต้องการมากกว่าคำแนะนำ?,
sos.final_cta_subtext,sos-hotline,FINAL CTA,"Email us. Within 48 hours. Often sooner.","ส่งอีเมลหาเรา ภายใน 48 ชั่วโมง บ่อยครั้งเร็วกว่านั้น",
sos.final_cta_title,sos-hotline,FINAL CTA,Ready to Ask Your Question?,พร้อมถามคำถามหรือยัง?,
